id,japanese_name,scientific_name,order_name_ja,order_name_en,family_name_ja,family_name_en,genus_name,species_name,subspecies_name,distribution,note
1,アズミトガリネズミ,Sorex hosonoi,食虫目,Insectivora,トガリネズミ科,Soricidae,,,,本州中部地方の高山帯,
2,シントウトガリネズミ,Sorex shinto,食虫目,Insectivora,トガリネズミ科,Soricidae,,,,本州・四国の山地、佐渡島,
3,カワネズミ,Chimarrogale platycephala,食虫目,Insectivora,トガリネズミ科,Soricidae,,,,本州・九州の渓流,
4,ワタセジネズミ,Crocidura watasei,食虫目,Insectivora,トガリネズミ科,Soricidae,,,,奄美諸島、沖縄諸島,
5,ニホンジネズミ,Crocidura dsinezumi,食虫目,Insectivora,トガリネズミ科,Soricidae,,,,本州・四国・九州及び隣接する島嶼、北海道と済州島（韓国）に移入,
6,オリイジネズミ,Crocidura orii,食虫目,Insectivora,トガリネズミ科,Soricidae,,,,奄美大島・徳之島,
7,ヒメヒミズ,Dymecodon pilirostris,食虫目,Insectivora,モグラ科,Talpidae,,,,本州・四国・九州の山地,
8,ヒミズ,Urotrichus talpoides,食虫目,Insectivora,モグラ科,Talpidae,,,,本州・四国・九州・対馬・屋久島など,
9,ミズラモグラ,Euroscaptor mizura,食虫目,Insectivora,モグラ科,Talpidae,,,,本州の山地,
10,アズマモグラ,Mogera imaizumii,食虫目,Insectivora,モグラ科,Talpidae,,,,本州東部、紀伊半島、中国地方・四国などの山地,
11,コウベモグラ,Mogera wogura,食虫目,Insectivora,モグラ科,Talpidae,,,,本州西部、九州、四国、対馬、屋久島等,
12,サドモグラ,Mogera tokudae,食虫目,Insectivora,モグラ科,Talpidae,,,,佐渡島,
13,エチゴモグラ,Mogera etigo,食虫目,Insectivora,モグラ科,Talpidae,,,,越後平野,
14,センカクモグラ,Mogera uchidai,食虫目,Insectivora,モグラ科,Talpidae,,,,尖閣諸島魚釣島,
15,オキナワオオコウモリ,Pteropus loochoensis,翼手目,Chiroptera,オオコウモリ科,Pteropodidae,,,,沖縄本島で記録があるが絶滅したとされる,
16,オガサワラオオコウモリ,Pteropus pselaphon,翼手目,Chiroptera,オオコウモリ科,Pteropodidae,,,,小笠原諸島,
17,コキクガシラコウモリ,Rhinolophus cornutus,翼手目,Chiroptera,キクガシラコウモリ科,Rhinolophidae,,,,北海道、本州、四国、九州、奄美諸島、及び隣接する島嶼,
18,オキナワコキクガシラコウモリ,Rhinolophus pumilus,翼手目,Chiroptera,キクガシラコウモリ科,Rhinolophidae,,,,沖縄諸島、宮古諸島,
19,ヤエヤマコキクガシラコウモリ,Rhinolophys perditus,翼手目,Chiroptera,キクガシラコウモリ科,Rhinolophidae,,,,八重山諸島,
20,カグラコウモリ,Hipposideros turpis,翼手目,Chiroptera,カグラコウモリ科,Hipposideridae,,,,八重山諸島,
21,クビワコウモリ,Eptesicus japonensis,翼手目,Chiroptera,ヒナコウモリ科,Vespertilionidae,,,,本州中部地方,
22,コヤマコウモリ,Nyctalus furvus,翼手目,Chiroptera,ヒナコウモリ科,Vespertilionidae,,,,本州中部地方と東北地方,
23,モリアブラコウモリ,Pipistrellus endoi,翼手目,Chiroptera,ヒナコウモリ科,Vespertilionidae,,,,本州東北・中部・近畿・中国地方、四国,
24,オガサワラアブラコウモリ,Pipistrellus sturdeei,翼手目,Chiroptera,ヒナコウモリ科,Vespertilionidae,,,,小笠原諸島母島で記録があるが絶滅したとされる,
25,ニホンウサギコウモリ,Plecotus sacrimontis,翼手目,Chiroptera,ヒナコウモリ科,Vespertilionidae,,,,北海道、本州、四国、九州,
26,クロホオヒゲコウモリ,Myotis pruinosus,翼手目,Chiroptera,ヒナコウモリ科,Vespertilionidae,,,,本州、四国、九州,
27,ヤンバルホオヒゲコウモリ,Myotis yanbarensis,翼手目,Chiroptera,ヒナコウモリ科,Vespertilionidae,,,,奄美大島、徳之島、沖縄島,
28,リュウキュウユビナガコウモリ,Miniopterus fuscus,翼手目,Chiroptera,ヒナコウモリ科,Vespertilionidae,,,,奄美諸島、沖縄諸島、石垣島、西表島,
29,リュウキュウテングコウモリ,Murina ryukyuana,翼手目,Chiroptera,ヒナコウモリ科,Vespertilionidae,,,,奄美大島、徳之島、沖縄島,
30,クチバテングコウモリ,Murina tenebrosa,翼手目,Chiroptera,ヒナコウモリ科,Vespertilionidae,,,,対馬,
31,ニホンザル,Macaca fuscata,霊長目,Primates,オナガザル科,Cercopithecidae,,,,本州、四国、九州、屋久島,
32,ヤマネ,Glirulus japonicus,齧歯目,Rodentia,ヤマネ科,Gliridae,,,,本州、四国、九州,
33,ヤチネズミ,Eothenomys andersoni,齧歯目,Rodentia,ネズミ科,Muridae,,,,本州中部地方以東の山地、紀伊半島,
34,スミスネズミ　,Eothenomys smithii,齧歯目,Rodentia,ネズミ科,Muridae,,,,本州西部、四国、九州,
35,ハタネズミ,Microtus montebelli,齧歯目,Rodentia,ネズミ科,Muridae,,,,本州（紀伊半島を除く）、九州,
36,アマミトゲネズミ,Tokudaia osimensis,齧歯目,Rodentia,ネズミ科,Muridae,,,,奄美大島,
37,オキナワトゲネズミ,Tokudaia muenninki,齧歯目,Rodentia,ネズミ科,Muridae,,,,沖縄島,
38,トクノシマトゲネズミ,Tokudaia tokunosimensis,齧歯目,Rodentia,ネズミ科,Muridae,,,,徳之島,
39,アカネズミ,Apodemus speciosus,齧歯目,Rodentia,ネズミ科,Muridae,,,,北海道、本州、四国、九州、及び隣接する島嶼,
40,ヒメネズミ,Apodemus argenteus,齧歯目,Rodentia,ネズミ科,Muridae,,,,北海道、本州、四国、九州、及び隣接する島嶼,
41,ケナガネズミ,Diplothrix legata,齧歯目,Rodentia,ネズミ科,Muridae,,,,奄美大島、徳之島、沖縄島,
42,ニホンリス,Sciurus lis,齧歯目,Rodentia,リス科,Sciuridae,,,,本州、四国,
43,ムササビ,Petaurista leucogenys,齧歯目,Rodentia,リス科,Sciuridae,,,,本州、四国、九州,
44,ニホンモモンガ,Pteromys mononga,齧歯目,Rodentia,リス科,Sciuridae,,,,本州、四国、九州,
45,アマミノクロウサギ,Pentalagus furnessi,兎形目,Lagomorpha,ウサギ科,Leporidae,,,,奄美大島、徳之島,
46,ニホンノウサギ,Lepus brachyurus,兎形目,Lagomorpha,ウサギ科,Leporidae,,,,本州、四国、九州,
47,ニホンイタチ,Mustela itatsi,食肉目,Carnivora,イタチ科,Mustelidae,,,,本州、四国、九州、北海道等に移入,
48,ニホンテン,Martes melampus,食肉目,Carnivora,イタチ科,Mustelidae,,,,本州、四国、九州、北海道等に移入,
49,ニホンアナグマ　,Meles anakuma,食肉目,Carnivora,イタチ科,Mustelidae,,,,本州、四国、九州,
50,ニホンカモシカ,Capricornis crispus,偶蹄目,Artiodactyla,ウシ科,Bovidae,,,,本州、四国、九州,
51,ヤマドリ,Syrmaticus soemmerringii (Temminck、 1830),キジ目,,キジ科,Phasianidae,,,,本州、四国、九州,
52,ヤンバルクイナ,Gallirallus okinawae (Yamashina & Mano、 1981),ツル目,Gruiformes,クイナ科,Rallidae,,,,沖縄島,
53,アマミヤマシギ,Scolopax mira Hartert、 1916,,,シギ科,Scolopacidae,,,,奄美諸島,
54,アオゲラ,Picus awokera Temminck、 1836,,,キツツキ科,Picidae,,,,本州、四国、九州、屋久島、種子島,
55,ノグチゲラ,Sapheopipo noguchii (Seebohm、 1887),,,キツツキ科,Picidae,,,,沖縄島,
56,ルリカケス,Garrulus lidthi Bonaparte、 1850,,,カラス科,Corvidae,,,,奄美諸島,
57,メグロ,Apalopteron familiare (Kittlitz、 1830),,,メジロ科,Zosteropidae,,,,小笠原,
58,アカコッコ,Turdus celaenops Stejneger、 1887,,,ヒタキ科,Muscicapidae,,,,伊豆諸島、トカラ列島,
59,アカヒゲ,Luscinia komadori (Temminck、 1835),,,ヒタキ科,Muscicapidae,,,,男女群島、南西諸島,
60,カヤクグリ,Prunella rubida (Temminck & Schlegel、 1845),,,イワヒバリ科,Prunellidae,,,,南千島から九州まで,
61,セグロセキレイ,Motacilla grandis Sharpe、 1885,,,セキレイ科,Motacillidae,,,,北海道から九州,韓国、台湾、中国での記録有り
62,オガサワラカラスバト,Columba versicolor Kittlitz、 1832,,,ハト科,Columbidae,,,,父島、媒島,
63,リュウキュウカラスバト,Columba jouyi (Stejneger、 1887),,,ハト科,Columbidae,,,,沖縄諸島、大東諸島,
64,ミヤコショウビン,Todiramphus miyakoensis (Kuroda、 1919),,,カワセミ科,Alcedinidae,,,,宮古島,タイプ標本1点のみで実在したか疑問視されている
65,オガサワラガビチョウ,Cichlopasser terrestris (Kittlitz、 1830)　,,,ヒタキ科,Muscicapidae,,,,小笠原,
66,オガサワラマシコ,Chaunoproctus ferreorostris (Vigors、 1829),,,アトリ科,Fringillidae,,,,父島,
67,アホウドリ,Phoebastria albatrus (Pallas、 1769),,,アホウドリ科,Diomedeidae,,,,鳥島、尖閣諸島で繁殖,ハワイで繁殖記録あり
68,オガサワラヒメミズナギドリ,Puffinus bryani Pyle、 Welch & Fleischer、 2011,,,ミズナギドリ科,Procellariidae,,,,小笠原諸島の東島で繁殖,
69,ミゾゴイ,Gorsachius goisagi (Temminck、 1836),,,サギ科,Ardeidae,,,,本州、佐渡、隠岐、四国、九州,済州島での繁殖記録ある？
70,メボソムシクイ,Phylloscopus xanthodryas (Swinhoe、 1863),,,ムシクイ科,Phylloscopidae,,,,本州、四国、九州で繁殖,
71,イイジマムシクイ,Phylloscopus ijimae (Stejneger、 1892),,,ムシクイ科,Phylloscopidae,,,,伊豆諸島、トカラ列島で繁殖,
72,ノジコ,Emberiza sulphurata Temminck & Schlegel、 1848,,,ホオジロ科,Emberizidae,,,,本州北中部で繁殖,
73,ニホンイシガメ,Mauremys japonica,カメ目,Testudines,イシガメ科,Geoemydidae,,,,関東・甲信以西の本州、四国、九州と周辺島嶼,
74,ヤエヤマイシガメ,Mauremys mutica kami,カメ目,Testudines,イシガメ科,Geoemydidae,,,,石垣島、西表島、与那国島,固有亜種
75,ヤエヤマセマルハコガメ,Cuora flavomarginata evelynae,カメ目,Testudines,イシガメ科,Geoemydidae,,,,石垣島、西表島,固有亜種
76,リュウキュウヤマガメ,Geoemyda japonica,カメ目,Testudines,イシガメ科,Geoemydidae,,,,沖縄島、久米島、渡嘉敷島,
77,オビトカゲモドキ,Goniurosaurus splendens,トカゲ亜目,Lacertilia,トカゲモドキ科,Eublepharidae,,,,徳之島,
78,クロイワトカゲモドキ,Goniurosaurus kuroiwae,トカゲ亜目,Lacertilia,トカゲモドキ科,Eublepharidae,,,,沖縄諸島,5亜種（クロイワトカゲモドキ、マダラトカゲモドキ、クメトカゲモドキ、イヘヤトカゲモドキ、ケラマトカゲモドキ）
79,アマミヤモリ,Gekko vertebralis,トカゲ亜目,Lacertilia,ヤモリ科,Gekkonidae,,,,小宝島、奄美群島,
80,タカラヤモリ,Gekko shibatai,トカゲ亜目,Lacertilia,ヤモリ科,Gekkonidae,,,,小宝島近くの小島、宝島,
81,タワヤモリ,Gekko tawaensis,トカゲ亜目,Lacertilia,ヤモリ科,Gekkonidae,,,,本州、四国、九州の瀬戸内海沿岸,
82,ヤクヤモリ,Gekko yakuensis,トカゲ亜目,Lacertilia,ヤモリ科,Gekkonidae,,,,九州南部、屋久島、種子島、馬毛島,
83,オキナワキノボリトカゲ,Japalura polygonata polygonata,トカゲ亜目,Lacertilia,アガマ科,Agamidae,,,,奄美群島、沖縄諸島,固有亜種
84,サキシマキノボリトカゲ,Japalura polygonata ishigakiensis,トカゲ亜目,Lacertilia,アガマ科,Agamidae,,,,宮古諸島、八重山諸島（与那国島除く）,固有亜種
85,ヨナグニキノボリトカゲ,Japalura polygonata donan,トカゲ亜目,Lacertilia,アガマ科,Agamidae,,,,与那国島,固有亜種
86,オガサワラトカゲ,Cryptoblepharus nigropunctatus,トカゲ亜目,Lacertilia,トカゲ科,Scincidae,,,,小笠原諸島、鳥島、南鳥島,
87,サキシマスベトカゲ,Scincella boettgeri,トカゲ亜目,Lacertilia,トカゲ科,Scincidae,,,,宮古諸島、八重山諸島,
88,イシガキトカゲ,Plestiodon stimpsonii,トカゲ亜目,Lacertilia,トカゲ科,Scincidae,,,,八重山諸島,
89,オオシマトカゲ,Plestiodon oshimensis,トカゲ亜目,Lacertilia,トカゲ科,Scincidae,,,,奄美群島、宝島、小宝島、諏訪之瀬島,
90,オカダトカゲ,Plestiodon latiscutatus,トカゲ亜目,Lacertilia,トカゲ科,Scincidae,,,,伊豆半島、伊豆諸島（青ヶ島以北）,
91,オキナワトカゲ,Plestiodon marginatus ,トカゲ亜目,Lacertilia,トカゲ科,Scincidae,,,,沖縄諸島、与論島、沖永良部島、中之島,
92,キシノウエトカゲ,Plestiodon kishinouyei,トカゲ亜目,Lacertilia,トカゲ科,Scincidae,,,,宮古諸島、八重山諸島,
93,クチノシマトカゲ,Plestiodon kuchinoshimensis,トカゲ亜目,Lacertilia,トカゲ科,Scincidae,,,,口之島,
94,センカクトカゲ,Plestiodon takarai,トカゲ亜目,Lacertilia,トカゲ科,Scincidae,,,,尖閣諸島（魚釣島、北小島、南小島、久場島）,
95,ニホントカゲ,Plestiodon japonicus,トカゲ亜目,Lacertilia,トカゲ科,Scincidae,,,,近畿以西の本州、四国、九州と周辺島嶼（対馬除く）,
96,バーバートカゲ,Plestiodon barbouri,トカゲ亜目,Lacertilia,トカゲ科,Scincidae,,,,沖縄島、渡嘉敷島、久米島、奄美大島、加計呂麻島、請島、与路島、徳之島,
97,ヘリグロヒメトカゲ,Ateuchosaurus pellopleurus,トカゲ亜目,Lacertilia,トカゲ科,Scincidae,,,,沖縄諸島、奄美群島、トカラ列島、大隅諸島（竹島、硫黄島、黒島）,
98,アオカナヘビ,Takydromus smaragdinus,トカゲ亜目,Lacertilia,カナヘビ科,Lacertidae,,,,沖縄諸島、奄美群島、トカラ列島（宝島、小宝島）,
99,サキシマカナヘビ,Takydromus dorsalis,トカゲ亜目,Lacertilia,カナヘビ科,Lacertidae,,,,石垣島、西表島、黒島,
100,ニホンカナヘビ,Takydromus tachydromoides,トカゲ亜目,Lacertilia,カナヘビ科,Lacertidae,,,,北海道、本州、四国、九州と周辺島嶼（諏訪之瀬島以北）,
101,ミヤコカナヘビ,Takydromus toyamai,トカゲ亜目,Lacertilia,カナヘビ科,Lacertidae,,,,宮古島、伊良部島、下地島,
102,イワサキセダカヘビ,Pareas iwasakii,ヘビ亜目,Serpentes,セダカヘビ科,Pareatidae,,,,石垣島、西表島,
103,アマミタカチホヘビ,Achalinus werneri,ヘビ亜目,Serpentes,タカチホヘビ科,Xenodermatidae,,,,奄美大島、枝手久島、加計呂麻島、徳之島、沖縄島、渡嘉敷島,
104,ヤエヤマタカチホヘビ,Achalinus formosanus chigirai,ヘビ亜目,Serpentes,タカチホヘビ科,Xenodermatidae,,,,石垣島、西表島,固有亜種
105,サキシマアオヘビ,Cyclophiops herminae,ヘビ亜目,Serpentes,ナミヘビ科,Colubridae,,,,八重山諸島,
106,リュウキュウアオヘビ,Cyclophiops semicarinatus,ヘビ亜目,Serpentes,ナミヘビ科,Colubridae,,,,沖縄諸島、奄美群島、トカラ列島（宝島、小宝島）,
107,サキシマバイカダ,Lycodon ruhstrati multifasciatus,ヘビ亜目,Serpentes,ナミヘビ科,Colubridae,,,,宮古島、石垣島、西表島,固有亜種
108,キクザトサワヘビ,Opisthotropis kikuzatoi,ヘビ亜目,Serpentes,ナミヘビ科,Colubridae,,,,久米島,
109,ジムグリ,Euprepiophis conspicillatus,ヘビ亜目,Serpentes,ナミヘビ科,Colubridae,,,,北海道、本州、四国、九州と周辺島嶼（屋久島以北、佐渡と対馬除く）,
110,アオダイショウ,Elaphe climacophora,ヘビ亜目,Serpentes,ナミヘビ科,Colubridae,,,,北海道、本州、四国、九州と周辺島嶼（口之島以北）,
111,シマヘビ,Elaphe quadrivirgata,ヘビ亜目,Serpentes,ナミヘビ科,Colubridae,,,,北海道、本州、四国、九州と周辺島嶼（口之島以北、対馬除く）,
112,サキシマスジオ,Elaphe taeniura schmackeri,ヘビ亜目,Serpentes,ナミヘビ科,Colubridae,,,,宮古諸島、石垣島、西表島、小浜島,固有亜種
113,ヨナグニシュウダ,Elaphe carinata yonaguniensis,ヘビ亜目,Serpentes,ナミヘビ科,Colubridae,,,,与那国島,固有亜種
114,ガラスヒバァ,Hebius pryeri,ヘビ亜目,Serpentes,ナミヘビ科,Colubridae,,,,奄美群島、沖縄諸島,
115,ヒバカリ,Hebius vibakari vibakari,ヘビ亜目,Serpentes,ナミヘビ科,Colubridae,,,,本州、四国、九州と周辺島嶼（対馬除く）,固有亜種
116,ダンジョヒバカリ,Hebius vibakari danjoensis,ヘビ亜目,Serpentes,ナミヘビ科,Colubridae,,,,男女群島の男島（長崎）,固有亜種
117,ミヤコヒバァ,Hebius concelarus,ヘビ亜目,Serpentes,ナミヘビ科,Colubridae,,,,宮古島、伊良部島,
118,ヤエヤマヒバァ,Hebius ishigakiensis,ヘビ亜目,Serpentes,ナミヘビ科,Colubridae,,,,石垣島、西表島,
119,ミヤラヒメヘビ,Calamaria pavimentata miyarai,ヘビ亜目,Serpentes,ナミヘビ科,Colubridae,,,,与那国島,固有亜種
120,ミヤコヒメヘビ,Calamaria pfefferi,ヘビ亜目,Serpentes,ナミヘビ科,Colubridae,,,,宮古島、伊良部島,
121,アカマタ,Dinodon semicarinatum,ヘビ亜目,Serpentes,ナミヘビ科,Colubridae,,,,奄美群島、沖縄諸島,
122,サキシママダラ,Dinodon rufozonatum walli,ヘビ亜目,Serpentes,ナミヘビ科,Colubridae,,,,宮古諸島、八重山諸島,固有亜種
123,シロマダラ,Dinodon orientale,ヘビ亜目,Serpentes,ナミヘビ科,Colubridae,,,,北海道、本州、四国、九州と周辺島嶼（屋久島以北、対馬除く）,
124,ヤマカガシ,Rhabdophis tigrinus,ヘビ亜目,Serpentes,ナミヘビ科,Colubridae,,,,本州、四国、九州と周辺島嶼（屋久島以北、対馬除く）,
125,ヒャン,Sinomicrurus japonicus,ヘビ亜目,Serpentes,コブラ科,Elapidae,,,,奄美群島、沖縄諸島,2亜種（ヒャン、ハイ）
126,イワサキワモンベニヘビ,Sinomicrurus macclellandi iwasakii,ヘビ亜目,Serpentes,コブラ科,Elapidae,,,,石垣島、西表島,固有亜種
127,サキシマハブ,Protobothrops elegans,ヘビ亜目,Serpentes,クサリヘビ科,Viperidae,,,,八重山諸島（与那国島、波照間島除く）,
128,トカラハブ,Protobothrops tokarensis,ヘビ亜目,Serpentes,クサリヘビ科,Viperidae,,,,宝島、小宝島,
129,ハブ,Protobothrops flavoviridis,ヘビ亜目,Serpentes,クサリヘビ科,Viperidae,,,,奄美群島、沖縄諸島,
130,ツシママムシ,Gloydius tsushimaensis,ヘビ亜目,Serpentes,クサリヘビ科,Viperidae,,,,対馬,
131,ニホンマムシ,Gloydius blomhoffii,ヘビ亜目,Serpentes,クサリヘビ科,Viperidae,,,,北海道、本州、四国、九州と周辺島嶼（屋久島以北、対馬除く）,
132,ヒメハブ,Ovophis okinavensis,ヘビ亜目,Serpentes,クサリヘビ科,Viperidae,,,,奄美群島、沖縄諸島,
133,アカイシサンショウウオ,Hynobius katoi,有尾目,Caudata,サンショウウオ科,Hynobiidae,,,,本州中部（静岡、山梨、長野、愛知）,
134,アベサンショウウオ,Hynobius abei,有尾目,Caudata,サンショウウオ科,Hynobiidae,,,,北陸・近畿（石川、福井、京都、兵庫）,
135,アマクササンショウウオ,Hynobius amakusaensis,有尾目,Caudata,サンショウウオ科,Hynobiidae,,,,天草上島（熊本）,
136,イシヅチサンショウウオ,Hynobius hirosei,有尾目,Caudata,サンショウウオ科,Hynobiidae,,,,四国,
137,エゾサンショウウオ,Hynobius retardatus,有尾目,Caudata,サンショウウオ科,Hynobiidae,,,,北海道（島嶼部除く）,
138,オオイタサンショウウオ,Hynobius dunni,有尾目,Caudata,サンショウウオ科,Hynobiidae,,,,九州（大分、宮崎、熊本）、四国（高知）,
139,オオスミサンショウウオ,Hynobius osumiensis,有尾目,Caudata,サンショウウオ科,Hynobiidae,,,,大隅半島（鹿児島）,
140,オオダイガハラサンショウウオ,Hynobius boulengeri,有尾目,Caudata,サンショウウオ科,Hynobiidae,,,,紀伊半島（三重、奈良、和歌山）,
141,オキサンショウウオ,Hynobius okiensis,有尾目,Caudata,サンショウウオ科,Hynobiidae,,,,隠岐道後（島根）,
142,カスミサンショウウオ,Hynobius nebulosus,有尾目,Caudata,サンショウウオ科,Hynobiidae,,,,本州西部（愛知、岐阜、三重、近畿以西の本州）、四国4県、九州（宮崎除く）,
143,クロサンショウウオ,Hynobius nigrescens,有尾目,Caudata,サンショウウオ科,Hynobiidae,,,,北陸以東の本州（福井、石川、富山、岐阜、新潟、長野、群馬、栃木、茨城、東北6県）,
144,コガタブチサンショウウオ,Hynobius stejnegeri,有尾目,Caudata,サンショウウオ科,Hynobiidae,,,,本州中部（愛知、岐阜）・近畿（京都、兵庫除く）、四国（香川除く）、九州（佐賀、長崎除く）,
145,ソボサンショウウオ,Hynobius shinichisatoi,有尾目,Caudata,サンショウウオ科,Hynobiidae,,,,祖母傾山系（大分、宮崎、熊本）,
146,ツシマサンショウウオ,Hynobius tsuensis,有尾目,Caudata,サンショウウオ科,Hynobiidae,,,,対馬,
147,トウキョウサンショウウオ,Hynobius tokyoensis,有尾目,Caudata,サンショウウオ科,Hynobiidae,,,,関東（群馬除く）、東北南部（福島）,
148,トウホクサンショウウオ,Hynobius lichenatus,有尾目,Caudata,サンショウウオ科,Hynobiidae,,,,東北6県、関東（栃木、群馬）、北陸（新潟）,
149,ハクバサンショウウオ,Hynobius hidamontanus,有尾目,Caudata,サンショウウオ科,Hynobiidae,,,,本州中部（長野、岐阜）、北陸（富山、新潟）,
150,ヒダサンショウウオ,Hynobius kimurae,有尾目,Caudata,サンショウウオ科,Hynobiidae,,,,群馬、埼玉、東京以西の本州（和歌山除く）,
151,ブチサンショウウオ,Hynobius naevius,有尾目,Caudata,サンショウウオ科,Hynobiidae,,,,中国5県、九州（宮崎、鹿児島除く）,
152,ベッコウサンショウウオ,Hynobius ikioi,有尾目,Caudata,サンショウウオ科,Hynobiidae,,,,九州（宮崎、熊本、鹿児島）,
153,ホクリクサンショウウオ,Hynobius takedai,有尾目,Caudata,サンショウウオ科,Hynobiidae,,,,北陸（富山、石川）,
154,ミカワサンショウウオ,Hynobius mikawaensis,有尾目,Caudata,サンショウウオ科,Hynobiidae,,,,愛知,
155,キタオウシュウサンショウウオ,Onychodactylus nipponoborealis,有尾目,Caudata,サンショウウオ科,Hynobiidae,,,,東北北部（宮城、山形、岩手、秋田、青森）,
156,シコクハコネサンショウウオ,Onychodactylus kinneburi,有尾目,Caudata,サンショウウオ科,Hynobiidae,,,,四国（香川除く）、中国地方（岡山、広島、山口）,
157,タダミハコネサンショウウオ,Onychodactylus fuscus,有尾目,Caudata,サンショウウオ科,Hynobiidae,,,,東北南部（福島）、北陸（新潟）,
158,ツクバハコネサンショウウオ,Onychodactylus tsukubaensis,有尾目,Caudata,サンショウウオ科,Hynobiidae,,,,筑波山系（茨城）,
159,ハコネサンショウウオ,Onychodactylus japonicus,有尾目,Caudata,サンショウウオ科,Hynobiidae,,,,新潟、福島、栃木、茨城以西の本州（千葉と大阪除く）,
160,バンダイハコネサンショウウオ,Onychodactylus intermedius,有尾目,Caudata,サンショウウオ科,Hynobiidae,,,,東北南部（福島、宮城、山形）、関東（茨城）、北陸（新潟）,
161,オオサンショウウオ,Andrias japonicus,有尾目,Caudata,オオサンショウウオ科,Cryptobranchidae,,,,本州西部（愛知、岐阜以西の本州、北陸除く）、四国、九州（大分）,
162,イボイモリ,Echinotriton andersoni,有尾目,Caudata,イモリ科,Salamandridae,,,,奄美大島、徳之島、沖縄本島、瀬底島、渡嘉敷島,
163,アカハライモリ,Cynops pyrrhogaster,有尾目,Caudata,イモリ科,Salamandridae,,,,本州、四国、九州と周辺島嶼（対馬除く）,
164,シリケンイモリ,Cynops ensicauda,有尾目,Caudata,イモリ科,Salamandridae,,,,奄美群島、沖縄諸島,
165,ミヤコヒキガエル,Bufo gargarizans miyakonis,無尾目,Anura,ヒキガエル科,Bufonidae,,,,宮古諸島（宮古島、池間島、伊良部島、下地島）,固有亜種
166,ナガレヒキガエル,Bufo torrenticola,無尾目,Anura,ヒキガエル科,Bufonidae,,,,近畿（大阪、兵庫除く）、北陸（新潟除く）、岐阜,
167,ニホンヒキガエル,Bufo japonicus,無尾目,Anura,ヒキガエル科,Bufonidae,,,,本州、四国、九州と周辺島嶼（佐渡、対馬除く）,2亜種（二ホンヒキガエル、アズマヒキガエル）
168,ハロウエルアマガエル,Hyla hallowellii,無尾目,Anura,アマガエル科,Hylidae,,,,奄美群島、沖縄島,
169,アマミアカガエル,Rana kobai,無尾目,Anura,アカガエル科,Ranidae,,,,奄美大島、加計呂麻島、徳之島,
170,タゴガエル,Rana tagoi,無尾目,Anura,アカガエル科,Ranidae,,,,本州、四国、九州と周辺島嶼（対馬、佐渡除く）,3亜種（タゴガエル、オキタゴガエル、ヤクシマタゴガエル）
171,ツシマアカガエル,Rana tsushimensis,無尾目,Anura,アカガエル科,Ranidae,,,,対馬,
172,ナガレタゴガエル,Rana sakuraii,無尾目,Anura,アカガエル科,Ranidae,,,,栃木、新潟以西の本州（大阪、和歌山、広島除く）,
173,ニホンアカガエル,Rana japonica,無尾目,Anura,アカガエル科,Ranidae,,,,本州、四国、九州と周辺島嶼（対馬、佐渡除く）,
174,ネバタゴガエル,Rana neba,無尾目,Anura,アカガエル科,Ranidae,,,,静岡、長野、愛知,
